item	role	accession_or_version	source_or_parameter	checksum_or_value	notes
candidate_sequences	queries for direct final-candidate uniqueness screen	AsCEP19-CDSwin200-11-210; AsCEP20-CDSwin170-4-173	Supplementary_File_S6_candidate_fragments.fa	dda76465774c70713c3061e314cbc6d81badeb86a48f5e5c7842c0ae99db0437	Publication-facing candidate FASTA copied into the direct uniqueness screen without sequence changes.
NL03003_reference_genome	target genome for direct final-candidate uniqueness screen	GCA_002952155.1 ASM295215v1; CP022026.1 coordinate framework	GCA_002952155.1_ASM295215v1_genomic.fna	c8bf499803da95132405edf274747b17e6ac3f15d4e124866bef2a8d266a3d99	Full NL03003 genome FASTA used for BLAST database construction.
makeblastdb	nucleotide BLAST database construction	2.2.31+	-dbtype nucl -parse_seqids	not_applicable	Database built from the NL03003 reference genome.
blastn	direct candidate-level uniqueness search	2.2.31+	-task blastn; -dust no; -soft_masking false; -word_size 7; -evalue 1000; -max_target_seqs 100000	not_applicable	blastn: 2.2.31+; Package: blast 2.2.31, build Dec  3 2015 17:28:17; makeblastdb: 2.2.31+; Package: blast 2.2.31, build Dec  3 2015 17:28:17; seqkit v2.13.0
hit_interpretation	HSP-level uniqueness classification	not_applicable	HSP query coverage calculated as alignment length divided by query length; non-primary full-length, near-full-length, and significant partial high-identity HSPs assessed as competing placements.	not_applicable	Spliced CDS-derived candidates were interpreted against their compound genomic projections.
